{
  "$defs": {
    "ObservedChangeEvent": {
      "additionalProperties": false,
      "description": "One observed inventory delta. `containerId` is an opaque digest-derived\nhistory identity, never a raw Docker ID, readable ID fragment, or name.",
      "properties": {
        "containerId": {
          "pattern": "^docker_container_[0-9a-f]{64}$",
          "type": "string"
        },
        "currentStatus": {
          "anyOf": [
            {
              "$ref": "#/$defs/ObservedContainerStatus"
            },
            {
              "type": "null"
            }
          ],
          "description": "Schema-only union keeps optional status values required on the wire while\naccurately admitting the null state used by appearance/disappearance."
        },
        "id": {
          "pattern": "^[0-9a-f]{32}-[1-9][0-9]{0,19}$",
          "type": "string"
        },
        "kind": {
          "$ref": "#/$defs/ObservedChangeKind"
        },
        "observedAtMs": {
          "format": "uint64",
          "maximum": 9007199254740991,
          "minimum": 0,
          "type": "integer"
        },
        "previousStatus": {
          "anyOf": [
            {
              "$ref": "#/$defs/ObservedContainerStatus"
            },
            {
              "type": "null"
            }
          ],
          "description": "Schema-only union keeps optional status values required on the wire while\naccurately admitting the null state used by appearance/disappearance."
        }
      },
      "required": [
        "id",
        "kind",
        "observedAtMs",
        "containerId",
        "previousStatus",
        "currentStatus"
      ],
      "type": "object"
    },
    "ObservedChangeKind": {
      "description": "A deliberately small, daemon-lifetime observation delta. It is derived\nfrom two published Docker inventories, not from Docker's event stream.",
      "enum": [
        "container_appeared",
        "container_disappeared",
        "container_status_changed"
      ],
      "type": "string"
    },
    "ObservedContainerStatus": {
      "description": "Closed status classes prevent raw Docker status text from entering the\ntemporal-history boundary.",
      "enum": [
        "running",
        "stopped",
        "other"
      ],
      "type": "string"
    },
    "RuntimeMode": {
      "enum": [
        "docker",
        "mock"
      ],
      "type": "string"
    }
  },
  "$schema": "https://json-schema.org/draft/2020-12/schema",
  "additionalProperties": false,
  "description": "Bounded in-memory history for the daemon process only. `mock` never\ninherits a Docker baseline or events from an earlier source generation.",
  "properties": {
    "baselineEstablished": {
      "type": "boolean"
    },
    "currentModelRevision": {
      "anyOf": [
        {
          "maxLength": 64,
          "minLength": 1,
          "type": "string"
        },
        {
          "type": "null"
        }
      ]
    },
    "events": {
      "items": {
        "$ref": "#/$defs/ObservedChangeEvent"
      },
      "maxItems": 64,
      "type": "array"
    },
    "observedRevision": {
      "anyOf": [
        {
          "maxLength": 64,
          "minLength": 1,
          "type": "string"
        },
        {
          "type": "null"
        }
      ]
    },
    "source": {
      "$ref": "#/$defs/RuntimeMode"
    }
  },
  "required": [
    "source",
    "baselineEstablished",
    "currentModelRevision",
    "observedRevision",
    "events"
  ],
  "title": "ObservedChangeHistoryResponse",
  "type": "object"
}
